,Unnamed: 0,ticker,name,website,headquarter,employees,industry,type,source
3881,3881,JOUL,Joules Group PLC (JOUL),www.joulesgroup.com,"The Joules Barn Rockingham Road Market Harborough, LE16 7QD United Kingdom",1690,"Textiles, Apparel & Luxury Goods",ORD,investing
3882,3882,JRS,JPMorgan Russian Securities (JRS),am.jpmorgan.co.uk/investment-trusts/trusts/russian-securities-jpm-it.aspx?isin=GB0032164732,"20 Finsbury Street Finsbury Dials Hauptsitz London, EC2Y 9AQ United Kingdom",-,Capital Markets,Closed-End,investing
3883,3883,EJFZo,EJF Investments Ltd Preferred (EJFZo),www.ejfi.com,"IFC1, Esplanade Saint Helier, JE1 4BP Jersey",-,Capital Markets,Preferred,investing
3884,3884,RBWR,Rainbow Rare Earths Ltd (RBWR),www.rainbowrareearths.com,"Trafalgar Court Admiral Park St Peter Port Saint Peter Port, GY1 3EL Guernsey",261,Metals & Mining,ORD,investing
3885,3885,VANL,Van Elle Holdings PLC (VANL),www.van-elle.co.uk,"Southwell Lane Industrial Estate Summit Close Kirkby-in-Ashfield, NG17 8GJ United Kingdom",530,Construction & Engineering,ORD,investing
3886,3886,HDD,Hardide PLC (HDD),www.hardide.com,"9 Longlands Road Bicester, OX26 5AH United Kingdom",47,Chemicals,ORD,investing
3887,3887,ZAMB,Zambeef Products (ZAMB),zambeefplc.com,"Plot No. 4970, Manda Road Industrial Area Lusaka, Zambia",6834,Food Products,ORD,investing
3888,3888,BGHS,Boussard and Gavaudan Holding Ltd ORD (BGHS),www.bgholdingltd.com,"1 Vine Street London, W1J 0AH United Kingdom",-,Capital Markets,ORD,investing
3889,3889,ECRE,ECR Minerals PLC (ECRE),www.ecrminerals.com,"Office T3 Hurlingham Studios Ranelagh Gardens London, SW6 3PA United Kingdom",5,Metals & Mining,ORD,investing
3890,3890,CNSP,Corero Network Security Plc (CNSP),www.corero.com,"St Mary’s Court The Broadway Buckinghamshire Amersham, HP7 0UT United Kingdom",59,Software,ORD,investing
3891,3891,SAVES,Savannah Energy PLC (SAVES),www.savannah-energy.com,"40 Bank Street London, E14 5NR United Kingdom",211,"Oil, Gas & Consumable Fuels",ORD,investing
3892,3892,MCON,Mincon Group P (MCON),www.mincon.com,"Smithstown Industrial Estate Shannon, Ireland",567,Machinery,ORD,investing
3893,3893,KEFI,KEFI Minerals PLC (KEFI),www.kefi-minerals.com,"Wisdom Tower 1st Floor 2 Ayiou Pavlou & Kadmou Street Nicosia, 1105 Cyprus",44,Metals & Mining,ORD,investing
3894,3894,ARSA,Asiamet Resources Ltd (ARSA),www.asiametresources.com,"Gedung Graha Simatupang 7th Floor Tower Block 1D Jl. TB. Simatupang Kav. 3 Jakarta, Indonesia",-,Metals & Mining,ORD,investing
3895,3895,VNET,Vianet Group Plc (VNET),www.vianetplc.com,"One Surtees Way Surtees Business Park Stockton-On-Tees, TS18 3HR United Kingdom",109,"Electronic Equipment, Instruments & Components",ORD,investing
3896,3896,BPET,BMO Private Equity Trust PLC (BPET),www.fandc.com/fandc-private-equity-trust,"6th Floor Quartermile 4 7a Nightingale Way Edinburgh, EH3 9EG United Kingdom",-,Capital Markets,ORD,investing
3897,3897,GRCG,GRC International Group PLC (GRCG),www.grci.group,"Clive Court Unit 3 Bartholomews Walk Cambridgeshire Business Park Ely, CB7 4EA United Kingdom",149,IT Services,ORD,investing
3898,3898,MCB,McBride plc (MCB),www.mcbride.co.uk,"Middleton Way Middleton Manchester, M24 4DP United Kingdom",3331,Household Products,ORD,investing
3899,3899,GLDP,Goldplat Plc (GLDP),www.goldplat.com,"Salisbury House London Wall London, EC2M 5PS United Kingdom",318,Metals & Mining,ORD,investing
3900,3900,RENX,Renalytix AI plc (RENX),renalytix.com,"1460 Broadway New York, 10036 United States",54,Health Care Technology,ORD,investing
3901,3901,DUNE,Dunedin Enterprise Investment Trust (DUNE),www.dunedinenterprise.com,"2nd Floor Easter Dalry House 3 Distillery Lane Edinburgh, EH11 2BD United Kingdom",-,Capital Markets,Closed-End,investing
3902,3902,BRCK,Brickability Group Plc (BRCK),www.brickabilitygroupplc.com,"Queensgate House Cookham Road Bracknell, RG12 1RB United Kingdom",500,Construction Materials,ORD,investing
3903,3903,TGL,TransGlobe Energy Corporation (TGL),www.trans-globe.com,"444 – 5th Avenue SW Suite 900 Calgary, T2P 2T8 Canada",56,"Oil, Gas & Consumable Fuels",ORD,investing
3904,3904,REDX,Redx Pharma Plc (REDX),www.redxpharma.com,"Alderley Park Block 33 Mereside Alderley Edge Macclesfield, SK10 4TG United Kingdom",40,Pharmaceuticals,ORD,investing
3905,3905,ECT,Eurocastle Investment Ltd (ECT),www.eurocastleinv.com,"Regency Court Glategny Esplanade Saint Peter Port, GY1 1WW Guernsey",-,Real Estate Management & Development,ORD,investing
3906,3906,ATQT,ATTRAQT Group PLC (ATQT),www.attraqt.com,"236 Grays Inn Road London, WC1X 8HB United Kingdom",159,Software,ORD,investing
3907,3907,KPCK,Keystone Investment Trust PLC (KPCK),www.invescoperpetual.co.uk/portal/site/ip/products/productDetail?contentId=acbc6f4edefed210VgnVCM100,"Perpetual Park Perpetual Park Drive Henley-on-Thames, RG9 1HH United Kingdom",-,Capital Markets,ORD,investing
3908,3908,TRIN,Trinity Exploration and Production PLC (TRIN),trinityexploration.com,"Pinsent Masons LLP 1 Park Row Leeds, LS1 5AB United Kingdom",-,"Oil, Gas & Consumable Fuels",ORD,investing
3909,3909,CDFF,Cardiff Property PLC (CDFF),www.cardiff-property.com,"56 Station Road Egham, TW20 9LF United Kingdom",5,Real Estate Management & Development,ORD,investing
3910,3910,CRU,Coral Products (CRU),www.coralproducts.com,"Southmoor Road Roundthorn Industrial Estate Wythenshawe, M23 9DS United Kingdom",-,Containers & Packaging,ORD,investing
3911,3911,GDRG,Genedrive PLC (GDRG),www.genedriveplc.com,"The CTF Building 48 Grafton Street Manchester, M13 9XX United Kingdom",46,Life Sciences Tools & Services,ORD,investing
3912,3912,PSDL,Phoenix Spree Deutschland Ltd (PSDL),www.phoenixspree.com,"Royal Trust House 54 Jermyn Street London, SW1Y 6LX United Kingdom",-,Real Estate Management & Development,ORD,investing
3913,3913,SCEU,Surface Transforms Plc (SCEU),www.surfacetransforms.com,"Image Business Park Acornfield Road Knowsley Industrial Estate Liverpool, L33 7UF United Kingdom",48,Auto Components,ORD,investing
3914,3914,SNXS,Synectics Plc (SNXS),www.synecticsplc.com,"Synectics House 3-4 Broadfield Close Sheffield, S8 0XN United Kingdom",369,"Electronic Equipment, Instruments & Components",ORD,investing
3915,3915,GVP,Gabelli Value Plus Trust PLC (GVP),www.gabelli.com/Template/fundinfo.cfm?tid=MjNhOGY=&bid=MmFkOA==&mid=NTBmYjk=&num=NzJjYmQ=&kid=MTAxYm,"One Corporate Center Rye, 10580-1422 United States",-,Capital Markets,ORD,investing
3916,3916,PMGR,Portmeirion Group (PMGR),www.portmeiriongroup.com,"London Road Stoke-On-Trent, ST4 7QQ United Kingdom",850,Household Durables,ORD,investing
3917,3917,TED,Ted Baker PLC (TED),www.tedbakerplc.com,"The Ugly Brown Building 6a St Pancras Way London, NW1 0TB United Kingdom",2158,"Textiles, Apparel & Luxury Goods",ORD,investing
3918,3918,HHV,Hargreave Hale Aim Vct PLC (HHV),www.hargreaveaimvcts.co.uk/our-vcts,"9-11 Neptune Court Hallam Way Blackpool, FY4 5LZ United Kingdom",-,Capital Markets,ORD,investing
3919,3919,BLPU,Bloomsbury Publishing (BLPU),www.bloomsbury.com,"50 Bedford Square London, WC1B 3DP United Kingdom",738,Media,ORD,investing
3920,3920,MKA,Mkango Resources Ltd (MKA),www.mkango.ca,"550 Burrard Street Suite 2900 Vancouver, V6C 0A3 Canada",-,Metals & Mining,ORD,investing
3921,3921,ORCAO,Orcadian Energy PLC (ORCAO),orcadian.energy,"60 Gracechurch Street 6th Floor London, EC3V 0HR United Kingdom",5,"Oil, Gas & Consumable Fuels",ORD,investing
3922,3922,AMNX,Aminex (AMNX),www.aminex-plc.com,"Sandyford Business Park Corrig Road Paramount Court Dublin, D18 R9C7 Ireland",13,"Oil, Gas & Consumable Fuels",ORD,investing
3923,3923,BIOM,Biome Technologies Plc (BIOM),biometechnologiesplc.com,"Starpol Technology Centre North Road Marchwood Marchwood Southampton, SO40 4BL United Kingdom",31,Chemicals,ORD,investing
3924,3924,G4M,Gear4music Holdings PLC (G4M),www.gear4music.com,"Holgate Park Drive York, YO26 4GN United Kingdom",519,Specialty Retail,ORD,investing
3925,3925,MTRM,Metal Tiger PLC (MTRM),www.metaltigerplc.com,"Weston Farm House Weston Down Lane Weston Colley Winchester, S021 3AG United Kingdom",14,Metals & Mining,ORD,investing
3926,3926,MNP,Martin Currie Global Portfolio Trust plc (MNP),www.martincurrie.com/uk/global-portfolio-trust,"Saltire Court 20 Castle Terrace Edinburgh, EH1 2ES United Kingdom",-,Capital Markets,Closed-End,investing
3927,3927,NETC,Netcall (NETC),www.netcall.com,"Bedford Heights Suite 203 Brickhill Drive Bedford, MK41 7PH United Kingdom",234,Software,ORD,investing
3928,3928,MNL,Manchester and London Investment Trust plc (MNL),www.manchesterandlondon.co.uk,"2ND FLOOR, BLOCK E, IVEAGH COURT HARCOURT ROAD DUBLIN DUBLIN 2, Ireland",-,Capital Markets,Closed-End,investing
3929,3929,DEST,Destiny Pharma PLC (DEST),www.destinypharma.com,"Sussex Innovation Centre Unit 36 Science Park Square Falmer Brighton, BN1 9SB United Kingdom",14,Biotechnology,ORD,investing
3930,3930,ZENZ,Zenith Energy Ltd (ZENZ),www.zenithenergy.ca,"Bankers Court 15th Floor Suite 1500 850–2nd Street S.W. Calgary, T2P 0R8 Canada",59,"Oil, Gas & Consumable Fuels",ORD,investing
3931,3931,IPF,International Personal Finance PLC (IPF),www.ipfin.co.uk,"Number Three Leeds City Office Park Meadow Lane Leeds, LS11 5BD United Kingdom",8321,Consumer Finance,ORD,investing
3932,3932,OTB,On The Beach Group PLC (OTB),www.onthebeachgroupplc.com,"Aeroworks 5 Adair Street Manchester, M1 2NQ United Kingdom",494,"Hotels, Restaurants & Leisure",ORD,investing
3933,3933,GTC,Getech Group (GTC),www.getech.com,"Kitson House Elmete Hall Elmete Lane Leeds, LS8 2LJ United Kingdom",63,Energy Equipment & Services,ORD,investing
3934,3934,MUL,Mulberry Group PLC (MUL),www.mulberry.com,"The Rookery Chilcompton Bath, BA3 4EH United Kingdom",998,"Textiles, Apparel & Luxury Goods",ORD,investing
3935,3935,GATC,GATTACA Plc (GATC),www.gattacaplc.com,"1450 Parkway Solent Business Park Whiteley Fareham, PO15 7AF United Kingdom",483,Professional Services,ORD,investing
3936,3936,FNTL,Fintel PLC (FNTL),www.wearefintel.com,"Fintel House St. Andrews Road Huddersfield, HD1 6NA United Kingdom",575,Professional Services,ORD,investing
3937,3937,OVB,Ovoca Gold PLC (OVB),ovocabio.com,"17 Pembroke Street Upper D02 AT22 Dublin, 2 Ireland",-,Pharmaceuticals,ORD,investing
3938,3938,BCIB,BMO Capital and Income Investment Trust PLC (BCIB),www.fandc.com/uk/private-investors/investment-trusts/fandc-capital-and-income-investment-trust,"6th Floor Quartermile 4 7a Nightingale Way Edinburgh, EH3 9EG United Kingdom",-,Capital Markets,ORD,investing
3939,3939,SISS,Science in Sport plc (SISS),www.scienceinsport.com,"16-18 Hatton Garden 2nd Floor Farringdon London, EC1N 8AT United Kingdom",176,Personal Products,ORD,investing
3940,3940,EISB,East Imperial PLC (EISB),www.eastimperial.com,"27 Bath Street Level 2 Parnell Auckland, 1052 New Zealand",-,Beverages,ORD,investing
3941,3941,DCTA,Directa Plus PLC (DCTA),www.directa-plus.com,"ComoNExT Science Park Via Cavour 2 Lomazzo, 22074 Italy",193,Chemicals,ORD,investing
3942,3942,CAPD,Capital Drilling Ltd (CAPD),www.capdrill.com,"The CORE Building 9th Floor Ébène CyberCity Ebene, Mauritius",671,Energy Equipment & Services,ORD,investing
3943,3943,NAH,NAHL Group PLC (NAH),www.nahlgroupplc.co.uk,"Bevan House Kettering Parkway Kettering Venture Park Kettering, NN15 6XR United Kingdom",249,Media,ORD,investing
3944,3944,SOST,The Scottish Oriental Smaller Companies Trust plc (SOST),www.scottishoriental.com/uk/SOSCOT/Home,"23 St. Andrew Square Edinburgh, EH2 1BB United Kingdom",-,Capital Markets,Closed-End,investing
3945,3945,BHGG,BH Global Ltd (BHGG),www.bhglobal.com,"6th Floor 37 Esplanade St. Helier, JE2 3QA Jersey",-,Capital Markets,ORD,investing
3946,3946,BMV,Bluebird Merchants Ventures Ltd (BMV),bluebirdmv.com,"Harney Westwood & Riegels Craigmuir Chambers PO Box 71 Road Town, VG1110 British Virgin Islands",8,Metals & Mining,ORD,investing
3947,3947,MMXM,Minds + Machines Group Ltd (MMXM),www.mmx.co,"Craigmuir Chambers Road Town, VG 1110 British Virgin Islands",16,IT Services,ORD,investing
3948,3948,IOG,Iog PLC (IOG),www.iog.co.uk,"60 Gracechurch Street 6th Floor 189 Shaftesbury Avenue London, EC3V 0HR United Kingdom",52,"Oil, Gas & Consumable Fuels",ORD,investing
3949,3949,AEX,AEX Gold Inc (AEX),www.aexgold.com,"3400, One First Canadian Place PO Box 130 Toronto, M5X 1A4 Canada",-,Metals & Mining,ORD,investing
3950,3950,ORDN,Ordina NV (ORDN),www.ordina.nl,"Ringwade 1 Nieuwegein, 3439 LM Netherlands",2279,IT Services,ORD,investing
3951,3951,ZIOC,Zanaga Iron Ore Co Ltd (ZIOC),www.zanagairon.com,"Coastal Building 2nd Floor Wickham’s Cay II PO Box 2221 Road Town, British Virgin Islands",-,Metals & Mining,ORD,investing
3952,3952,VNHq,VietNam Holding Ltd (VNHq),www.vietnamholding.com,"Gartenstrasse 19 Zürich, 8002 Switzerland",-,Capital Markets,Closed-End,investing
3953,3953,CREO,Creo Medical Group PLC (CREO),creomedical.com,"Unit 2, Creo House Beaufort Park Beaufort Park Way Chepstow, NP16 5UH United Kingdom",217,Health Care Equipment & Supplies,ORD,investing
3954,3954,VRS,Versarien (VRS),www.versarien.com,"2 Chosen View Road Gloucestershire Cheltenham, GL51 9LT United Kingdom",-,Chemicals,ORD,investing
3955,3955,OCTP,Oxford Cannabinoid Technologies Holdings PLC (OCTP),www.oxcantech.com,"Maddox House 1 Maddox Street London, W1S 2PZ United Kingdom",-,Pharmaceuticals,ORD,investing
3956,3956,JAY,Bluejay Mining PLC (JAY),www.bluejaymining.com,"15 Ingestre Place Suite 1 London, W1F 0DU United Kingdom",13,Metals & Mining,ORD,investing
3957,3957,TRCS,Tracsis Plc (TRCS),www.tracsis.com,"Nexus Discovery Way Leeds, LS2 3AA United Kingdom",757,Software,ORD,investing
3958,3958,MSTL,MS INTERNATIONAL plc (MSTL),www.msiplc.com,"Balby Carr Bank Doncaster, DN4 8DH United Kingdom",-,Aerospace & Defense,ORD,investing
3959,3959,MPE,M.P.Evans Group (MPE),www.mpevans.co.uk,"3 Clanricarde Gardens Tunbridge Wells, TN1 1HQ United Kingdom",7200,Food Products,ORD,investing
3960,3960,BRH,Braveheart Investment Group (BRH),www.braveheartgroup.co.uk,"1 Capitol Court Capitol Business Park Dodworth Barnsley, S75 3TZ United Kingdom",7,Capital Markets,ORD,investing
3961,3961,AVO,Advanced Oncotherapy Plc (AVO),www.avoplc.com,"4 Tenterden Street Third Floor London, W1S 1TE United Kingdom",139,Health Care Equipment & Supplies,ORD,investing
3962,3962,4GBL,4Global PLC (4GBL),www.4global.com,"Venture X, Building 7 5th Floor Chiswick Park 566 Chiswick High Road, Chiswick London,W4 5YG United Kingdom",-,Software,ORD,investing
3963,3963,INS,Instem PLC (INS),www.instem.com,"Diamond Way Stone Business Park Stone, ST15 0SD United Kingdom",480,Health Care Technology,ORD,investing
3964,3964,LSAI,Location Sciences Group PLC (LSAI),www.locationsciences.ai,"St James House First Floor St James Square Cheltenham, GL50 3PR United Kingdom",14,Software,ORD,investing
3965,3965,BVC,Batm Advanced Communications Ltd (BVC),www.batm.com,"Neve Ne’eman Ind. Area 4 Ha’harash Street POB 7318 Hod HaSharon, 4524075 Israel",1196,Communications Equipment,ORD,investing
3966,3966,NWF,N.W.F Group (NWF),www.nwf.co.uk,"Wardle Nantwich, CW5 6BP United Kingdom",1200,"Oil, Gas & Consumable Fuels",ORD,investing
3967,3967,AVAP,Avation PLC (AVAP),www.avation.net,"No.01-01 65 Kampong Bahru Road Singapore, 169370 Singapore",23,Trading Companies & Distributors,ORD,investing
3968,3968,IAT,Invesco Asia Trust (IAT),www.invescoperpetual.co.uk/portal/site/ip/products/productDetail?contentId=be8a21e22b45f210VgnVCM100,"30 Finsbury Square London, EC2A 1AG United Kingdom",-,Capital Markets,ORD,investing
3969,3969,PREM,Premier African Minerals Ltd (PREM),www.premierafricanminerals.com,"Craigmuir Chambers Road Town PO Box 71 Tortola, VG 1110 British Virgin Islands",11,Metals & Mining,ORD,investing
3970,3970,DEVC,Draper Esprit VCT PLC (DEVC),www.draperespritvct.com,"20 Garrick Street London, WC2E 9BT United Kingdom",-,Capital Markets,ORD,investing
3971,3971,NBDG,NB Distressed Debt Investment Fund Ltd (NBDG),www.nbddif.com/pindex.html,"4th Floor Lansdowne House 57 Berkeley Square London, W1J 6ER United Kingdom",-,Capital Markets,ORD,investing
3972,3972,LLAI,LungLife AI Inc (LLAI),www.lunglifeai.com,"2545 West Hillcrest Drive Suite 140 Thousand Oaks, 91320 United States",-,Biotechnology,ORD,investing
3973,3973,HFEL,Henderson Far East Income Ltd (HFEL),www.henderson.com/ukpi/fund/201/henderson-far-east-income-limited,"201 Bishopsgate London, EC2M 3AE United Kingdom",-,Capital Markets,Closed-End,investing
3974,3974,AGLE,Angle Plc (AGLE),angleplc.com,"Surrey Research Park 10 Nugent Road Guildford, GU2 7AF United Kingdom",-,Health Care Equipment & Supplies,ORD,investing
3975,3975,EKF,EKF Diagnostics Holdings Plc (EKF),www.ekfdiagnostics.com,"Avon House 19 Stanwell Road Penarth Cardiff, CF64 2EZ United Kingdom",356,Health Care Equipment & Supplies,ORD,investing
3976,3976,EKI,Ekinops SA (EKI),www.ekinops.com,"3 rue Blaise Pascal Lannion, 22300 France",432,Communications Equipment,ORD,investing
3977,3977,LFI,London Finance and Investment Group PLC (LFI),www.city-group.com/london-finance-investment-group-plc,"1 Ely Place, London, EC1N 6RY United Kingdom",-,Capital Markets,ORD,investing
3978,3978,SMJ,J Smart Co Contractors PLC (SMJ),www.jsmart.co.uk,"28 Cramond Road South Edinburgh, EH4 6AB United Kingdom",-,Construction & Engineering,ORD,investing
3979,3979,PHTM,Photo-Me International (PHTM),www.photo-me.co.uk,"Unit 3B Blenhiem Road Bookham, KT19 9AP United Kingdom",1056,Leisure Products,ORD,investing
3980,3980,FSJ,James Fisher and Sons PLC (FSJ),www.james-fisher.com,"Fisher House Michaelson Road PO Box 4 Barrow-in-Furness, LA14 1HR United Kingdom",2738,Transportation Infrastructure,ORD,investing
3981,3981,TSG,Trans-Siberian Gold Plc (TSG),www.trans-siberiangold.com,"P.O. Box 278 Saint Neots, PE19 9EA United Kingdom",-,Metals & Mining,ORD,investing
3982,3982,NGHT,Nightcap PLC (NGHT),nightcapplc.com,"201 Bishopsgate London, EC2M 3AB United Kingdom",353,"Hotels, Restaurants & Leisure",ORD,investing
3983,3983,UKOGa,UK Oil & Gas Investments A PLC (UKOGa),www.ukogplc.com,"The Broadgate Tower 8th Floor 20 Primrose Street London, EC2A 2EW United Kingdom",13,"Oil, Gas & Consumable Fuels",ORD,investing
3984,3984,SBRE,Sabre Insurance Group PLC (SBRE),www.sabreplc.co.uk,"Sabre House 150 South Street Surrey Dorking, RH4 2YY United Kingdom",160,Insurance,ORD,investing
3985,3985,INGI,Ingenta PLC (INGI),www.ingenta.com,"8100 Alec Issigonis Way Oxford, OX4 2HU United Kingdom",81,IT Services,ORD,investing
3986,3986,CLLN,Carillion PLC (CLLN),www.carillionplc.com,"Carillion House 84 Salop Street Wolverhampton, WV3 0SR United Kingdom",31628,Construction & Engineering,ORD,investing
3987,3987,ANII,Aberdeen New India Investment Trust PLC (ANII),www.aberdeen-newindia.co.uk/itnewindia,"21 Church Street Suite 01-01 Capital Square Two Singapore, 049480 Singapore",-,Capital Markets,Closed-End,investing
3988,3988,JLEC,Jersey Electricity PLC (JLEC),www.jec.co.uk,"The Powerhouse PO Box 45 Queens Road Saint Helier, JE4 8NY Jersey",305,Electric Utilities,ORD,investing
3989,3989,SHRS,Shires Income (SHRS),www.shiresincome.co.uk/itshiresincome,"10 Queens Terrace Aberdeen, AB10 1YG United Kingdom",-,Capital Markets,Closed-End,investing
3990,3990,GOG,Go-Ahead Group PLC (GOG),www.go-ahead.com,"4 Matthew Parker Street Westminster London, SW1H 9NP United Kingdom",30000,Road & Rail,ORD,investing
3991,3991,SESTS,Securities Trust Of Scotland (SESTS),www.securitiestrust.com,"Saltire Court 20 Castle Terrace Edinburgh, EH1 2ES United Kingdom",-,Capital Markets,Closed-End,investing
3992,3992,PPHC,Public Policy Holding Company Inc (PPHC),pphcompany.com,"800 North Capitol Street NW Suite 800 Washington, 20002 United States",-,Professional Services,ORD,investing
3993,3993,CYNL,CQS Natural Resources Growth and Income PLC (CYNL),www.ncim.co.uk/CNRhome.shtml,"4th Floor One Strand London, WC2N 5HR United Kingdom",-,Capital Markets,Closed-End,investing
3994,3994,CGO,Contango Holdings PLC (CGO),contango-holdings-plc.co.uk,"1 Tudor Street 5th Floor London, EC4Y 0AH United Kingdom",-,Capital Markets,ORD,investing
3995,3995,FEET,Fundsmith Emerging Equities Trust plc (FEET),www.feetplc.co.uk,"33 Cavendish Square London, W1G 0PW United Kingdom",-,Capital Markets,ORD,investing
3996,3996,ITS,in Style Group PLC (ITS),corporate.inthestyle.com,"Olympic Court Unit 5 Salford, M50 2QP United Kingdom",133,Internet & Direct Marketing Retail,ORD,investing
3997,3997,QFI,Quadrise Fuels International (QFI),www.quadrisefuels.com,"Eastcastle House 27-28 Eastcastle Street London, W1W 8DH United Kingdom",9,"Oil, Gas & Consumable Fuels",ORD,investing
3998,3998,JEFI,Jupiter Emerging & Frontier Income Trust Plc (JEFI),www.jupiteram.com/en-GB/Financial-advisers-and-wealth-managers/Jupiter-Emerging-and-Frontier-Income-,"The Zig Zag Building 70 Victoria Street London, SW1E 6SQ United Kingdom",-,Capital Markets,ORD,investing
3999,3999,ADAA,Adams PLC (ADAA),www.adamsplc.co.uk,"15-17 Grosvenor Gardens London, SW1W 0BD United Kingdom",3,Capital Markets,ORD,investing
4000,4000,NBDX,NB Distressed Debt Investment Fund Ltd (NBDX),www.nbddif.com/pindex.html,"4th Floor Lansdowne House 57 Berkeley Square London, W1J 6ER United Kingdom",-,Capital Markets,ORD,investing
4001,4001,PACA,Pacific Assets Trust (PACA),www.pacific-assets.co.uk/PAT/Home,"23 St. Andrew Square Edinburgh, EH2 1BB United Kingdom",-,Capital Markets,Closed-End,investing
4002,4002,CAME,Camellia (CAME),www.camellia.plc.uk,"Linton Park Linton Maidstone, ME17 4AB United Kingdom",77221,Food Products,ORD,investing
4003,4003,GILDG,Guild Esports (GILDG),www.guildesports.com,"Craven House 16 Northumberland Avenue London, WC2N 5AP United Kingdom",21,Entertainment,ORD,investing
4004,4004,AFEN,AFC Energy Plc (AFEN),www.afcenergy.com,"Dunsfold Park Unit 71.4 Stovolds Hill Cranleigh, GU6 8TB United Kingdom",30,Electrical Equipment,ORD,investing
4005,4005,NESI,New Star Investment Trust PLC (NESI),www.nsitplc.com,"1 Knightsbridge Green London, SW1X 7QA United Kingdom",-,Capital Markets,Closed-End,investing
4006,4006,MOTR,Motorpoint Group PLC (MOTR),www.motorpointplc.com,"Salisbury House Stephensons Way Wyvern Business Park Chaddesden Derby, DE21 6LY United Kingdom",769,Specialty Retail,ORD,investing
4007,4007,WAND,Wandisco Plc (WAND),www.wandisco.com,"Castle House 1-13 Angel Street Sheffield, S3 8LN United Kingdom",187,Software,ORD,investing
4008,4008,OBD,Oxford Biodynamics PLC (OBD),www.oxfordbiodynamics.com,"3140 Rowan Place John Smith Drive Oxford Business Park South Oxford, OX4 2WB United Kingdom",37,Life Sciences Tools & Services,ORD,investing
4009,4009,SAE,Atlantis Resources Ltd (SAE),www.simecatlantis.com,"Edinburgh Quay 2 4th Floor 139 Fountainbridge Edinburgh, EH3 9QG United Kingdom",96,Electrical Equipment,ORD,investing
4010,4010,EPWN,Epwin Group PLC (EPWN),www.epwin.co.uk,"1b Stratford Court Cranmore Boulevard Solihull, B90 4QT United Kingdom",2030,Building Products,ORD,investing
4011,4011,FCAP,finnCap Group PLC (FCAP),www.finncap.com,"1 Bartholomew Close London, EC1A 7BL United Kingdom",151,Capital Markets,ORD,investing
4012,4012,BSRT,Baker Steel Resources Trust (BSRT),www.bakersteelresourcestrust.com,"86 Jermyn Street London, SW1Y 6JD United Kingdom",-,Capital Markets,ORD,investing
4013,4013,VELD,Van De Velde (VELD),www.vandevelde.eu,"Lageweg 4 Schellebelle, 9260 Belgium",1500,"Textiles, Apparel & Luxury Goods",ORD,investing
4014,4014,DDDD,4D Pharma PLC (DDDD),www.4dpharmaplc.com,"9 Bond Court 5th Floor Leeds, LS1 2JZ United Kingdom",92,Pharmaceuticals,ORD,investing
4015,4015,VAREV,Various Eateries Plc (VAREV),www.variouseateries.co.uk,"20 St. Thomas Street Runway East London, SE1 9RS United Kingdom",506,"Hotels, Restaurants & Leisure",ORD,investing
4016,4016,RCN,Redcentric (RCN),www.redcentricplc.com,"Central House Beckwith Knowle Harrogate, HG3 1UG United Kingdom",399,IT Services,ORD,investing
4017,4017,HYG,Seneca Growth Capital VCT PLC (HYG),www.senecavct.co.uk,"12 The Parks Haydock Newton-Le-Willows, WA12 0JQ United Kingdom",3,Capital Markets,ORD,investing
4018,4018,CNIC,CentralNic Group Plc (CNIC),www.centralnicgroup.com,"Saddlers House 4th Floor 44 Gutter Lane London, EC2V 6BR United Kingdom",569,IT Services,ORD,investing
4019,4019,BGCG,Baillie Gifford China Growth Trust PLC (BGCG),www.witanpacific.com,"Four Embarcadero Center Suite 550 San Francisco, 94111 United States",-,Capital Markets,Closed-End,investing
4020,4020,IIT,Independent Investment Trust PLC (IIT),www.independentinvestmenttrust.co.uk,"17 Dublin Street Edinburgh, EH1 3PG United Kingdom",2,Capital Markets,ORD,investing
4021,4021,BLP,Blue Planet Investment Trust PLC (BLP),www.blueplanet.eu/index.133.html,"18A Locker Street Sliema, 3124 Malta",-,Capital Markets,Closed-End,investing
4022,4022,ASITA,Aberforth Split Level Income Trust PLC (ASITA),www.aberforth.co.uk,"14 Melville Street Edinburgh, EH3 7NS United Kingdom",-,Capital Markets,ORD,investing
4023,4023,GETB,GetBusy PLC (GETB),www.getbusy.com,"Unity Campus Suite 8, The Works 20 West Street Pampisford Cambridge, CB22 3FT United Kingdom",136,Software,ORD,investing
4024,4024,AFHP,AFH Financial Group PLC (AFHP),www.afhwm.co.uk,"AFH House Buntsford Drive Stoke Health Bromsgrove, B60 4JE United Kingdom",-,Capital Markets,ORD,investing
4025,4025,MASTM,Mast Energy Developments PLC (MASTM),www.med.energy,"55 Ludgate Hill London, EC4M 7JW United Kingdom",-,Electric Utilities,ORD,investing
4026,4026,GPH,Global Ports Holding PLC (GPH),www.globalportsholding.com,"Büyükdere Cad. No:193 Levent 193 Plaza Giris kat Sisli Istanbul, 34394 Turkey",495,Transportation Infrastructure,ORD,investing
4027,4027,XPS,XPS Pensions Group PLC (XPS),www.xpsgroup.com,"Phoenix House 1 Station Hill Reading, RG1 1NB United Kingdom",1325,Capital Markets,ORD,investing
4028,4028,CLXC,Calnex Solutions Plc (CLXC),www.calnexsol.com,"Oracle Campus Linlithgow, EH49 7LR United Kingdom",113,Communications Equipment,ORD,investing
