,Unnamed: 0,ticker,name,website,headquarter,employees,industry,type,source
1611,1611,BP,BP PLC (BP),www.bp.com,"1 St James's Square London, SW1Y 4PD United Kingdom",63600,"Oil, Gas & Consumable Fuels",ORD,investing
1612,1612,AKE,Arkema SA (AKE),www.arkema.com,"420 rue d'Estienne d'Orves Cedex Colombes, 92700 France",20600,Chemicals,ORD,investing
1613,1613,JUSTJ,Just Group PLC (JUSTJ),www.justgroupplc.co.uk,"Enterprise House Bancroft Road Reigate, RH2 7RP United Kingdom",1038,Insurance,ORD,investing
1614,1614,RELIq,Reliance Industries Ltd DRC (RELIq),www.ril.com,"Maker Chambers IV 3rd Floor 222 Nariman Point Mumbai, 400021 India",236334,"Oil, Gas & Consumable Fuels",DRC,investing
1615,1615,ENB,Enbridge Inc (ENB),www.enbridge.com,"200, Fifth Avenue Place 425 - 1st Street SW Calgary, T2P 3L8 Canada",11200,"Oil, Gas & Consumable Fuels",ORD,investing
1616,1616,NEOEN,Neoen SA (NEOEN),www.neoen.com,"6, rue Ménars Paris, 75002 France",232,Independent Power and Renewable Electricity Producers,ORD,investing
1617,1617,TIETO,TietoEVRY Corp (TIETO),www.tietoevry.com,"Keilalahdentie 2-4 P.O.Box 2 Espoo, 02101 Finland",23860,IT Services,ORD,investing
1618,1618,NLMKq,Novolipetsk Steel PAO DRC (NLMKq),www.nlmk.com,"2, Metallurgov square Lipetsk, 398040 Russia",30181,Metals & Mining,DRC,investing
1619,1619,LTGL,Learning Technologies Group PLC (LTGL),www.ltgplc.com,"London, EC4A 1BW United Kingdom",790,Computer Services,ORD,investing
1620,1620,CBLP,Mersen (CBLP),www.mersen.com,"Tour EQHO 2 avenue Gambetta La Défense cedex CS 10077 Paris, 92066 France",6866,Electrical Equipment,ORD,investing
1621,1621,NOEJ,Norma Group AG NA O.N. (NOEJ),www.normagroup.com,"Edisonstrasse 4 Maintal, 63477 Germany",6484,Machinery,ORD,investing
1622,1622,ATMI,ASTM SpA (ATMI),www.astm.it,"Corso Regina Margherita 165 Turin, 10144 Italy",6075,Transportation Infrastructure,ORD,investing
1623,1623,STM,STMicroelectronics NV (STM),www.st.com,"39 Chemin du Champ des Filles 1228 Plan-Les-Ouates Geneva, Switzerland",46016,Semiconductors & Semiconductor Equipment,ORD,investing
1624,1624,S32,South32 Ltd (S32),www.south32.net,"108 St Georges Terrace Level 36 Perth, 6000 Australia",13624,Metals & Mining,ORD,investing
1625,1625,MRK,Merck & Company Inc (MRK),www.merck.com,"2000 Galloping Hill Road Kenilworth, 07033 United States",73500,Pharmaceuticals,ORD,investing
1626,1626,HOLMBs,Holmen AB (HOLMBs),www.holmen.com,"PO Box 5407 Stockholm, 114 84 Sweden",3300,Paper & Forest Products,ORD,investing
1627,1627,CAMX,Camurus AB (CAMX),www.camurus.com,"Ideon Science Park Lund, 223 70 Sweden",146,Pharmaceuticals,ORD,investing
1628,1628,YNGa,Young & Co’S Brewery A (YNGa),www.youngs.co.uk,"Riverside House 26 Osiers Road Wandsworth London, SW18 1NH United Kingdom",4185,"Hotels, Restaurants & Leisure",ORD,investing
1629,1629,GLTRq,Globaltrans Investment PLC (GLTRq),www.globaltrans.com,"Nizhnyay' Krasnoselskaya street 39 Bloulevard 1 Moscow, Russia",1777,Road & Rail,DRC,investing
1630,1630,BIFF,Biffa PLC (BIFF),www.biffa.co.uk,"Coronation Road Cressex High Wycombe, HP12 3TZ United Kingdom",8257,Commercial Services & Supplies,ORD,investing
1631,1631,SRAIL,Stadler Rail AG (SRAIL),www.stadlerrail.com,"Ernst-Stadler-Strasse 1 Bussnang, 9565 Switzerland",12025,Machinery,ORD,investing
1632,1632,RNK,Rank Group PLC (RNK),www.rank.com,"TOR Saint-Cloud Way Maidenhead, SL6 8BN United Kingdom",4138,"Hotels, Restaurants & Leisure",ORD,investing
1633,1633,EKTABs,Elekta AB ser. B (EKTABs),www.elekta.com,"Kungstensgatan 18 Box 7593 Stockholm, 103 93 Sweden",4000,Health Care Equipment & Supplies,ORD,investing
1634,1634,PANI,Pantheon Internat Participations (PANI),www.piplc.com,"10 Finsbury Square 4th Floor London, EC2A 1AF United Kingdom",-,Capital Markets,Closed-End,investing
1635,1635,UBIP,Ubisoft Entertainment (UBIP),www.ubisoft.com,"2, avenue Pasteur Saint-Mandé, 94160 France",20754,Entertainment,ORD,investing
1636,1636,GRG,Greggs PLC (GRG),corporate.greggs.co.uk,"Greggs House Quorum Business Park Newcastle upon Tyne, NE12 8BU United Kingdom",21538,"Hotels, Restaurants & Leisure",ORD,investing
1637,1637,TEL,Telenor ASA (TEL),www.telenor.com,"Snarøyveien 30 Fornebu, 1360 Norway",18000,Diversified Telecommunication Services,ORD,investing
1638,1638,NIO,Nio Inc Class A ADR (NIO),www.nio.com,"Building 20 No. 56 AnTuo Road Anting Town Jiading District Shanghai, 201804 China",7763,Automobiles,ADR,investing
1639,1639,JET2,Jet2 PLC (JET2),www.jet2plc.com,"Low Fare Finder House Leeds Bradford Airport Leeds, LS19 7TU United Kingdom",9051,Airlines,ORD,investing
1640,1640,IHG,InterContinental Hotels Group PLC (IHG),www.ihgplc.com,"Broadwater Park Denham, UB9 5HR United Kingdom",12832,"Hotels, Restaurants & Leisure",ORD,investing
1641,1641,JEDT,JPMorgan Euro Small Companies Trust Plc (JEDT),am.jpmorgan.co.uk/investment-trusts/trusts/european-smaller-companies-jpm-it.aspx?isin=GB00BMTS0Z37,"60 Victoria Embankment London, EC4Y 0JP United Kingdom",-,Capital Markets,Closed-End,investing
1642,1642,ELUXb,Electrolux AB Class B (ELUXb),www.electroluxgroup.com,"S:t Goransgatan 143 Stadshagen Stockholm, 105 45 Sweden",48000,Household Durables,ORD,investing
1643,1643,MGAMM,Morgan Advanced Materials Plc (MGAMM),www.morganadvancedmaterials.com,"York House Sheet Street Windsor, SL4 1DD United Kingdom",7466,Machinery,ORD,investing
1644,1644,BWY,Bellway PLC (BWY),www.bellwayplc.co.uk,"Woolsington House Woolsington Newcastle upon Tyne, NE13 8BF United Kingdom",2908,Household Durables,ORD,investing
1645,1645,TFFP,Television Francaise 1 SA (TFFP),www.groupe-tf1.fr,"1, quai du Point-du-Jour Cedex Boulogne, 92656 France",3156,Media,ORD,investing
1646,1646,PSN,Persimmon PLC (PSN),www.persimmonhomes.com,"Persimmon House Fulford York, YO19 4FE United Kingdom",5000,Household Durables,ORD,investing
1647,1647,NTR,Nutrien Ltd (NTR),www.nutrien.com,"122 – 1st Avenue South Suite 500 Saskatoon, S7K 7G3 Canada",23100,Chemicals,ORD,investing
1648,1648,SNGRq,Societatea Nationala de Gaze Naturale Romgaz SA DRC (SNGRq),www.romgaz.ro,"Piata Constantin I. Motas. nr. 4 Medias, 551130 Romania",6066,"Oil, Gas & Consumable Fuels",DRC,investing
1649,1649,ABBV,AbbVie Inc (ABBV),www.abbvie.com,"1 North Waukegan Road North Chicago, 60064-6400 United States",50000,Biotechnology,ORD,investing
1650,1650,TL5,Mediaset ESP (TL5),www.mediaset.es,"Crta de Fuencarral to Alcobendas, no. 4 Madrid, 28049 Spain",1555,Media,ORD,investing
1651,1651,AMSU,Advanced Medical Solutions Group (AMSU),www.admedsol.com,"Premier Park 33 Road One Winsford Industrial Estate Winsford, CW7 3RT United Kingdom",700,Health Care Equipment & Supplies,ORD,investing
1652,1652,HBMN,HBM Healthcare Investments (HBMN),www.hbmhealthcare.com,"Bundesplatz 1 PO-Box 1145 Zug, 6301 Switzerland",700,Capital Markets,ORD,investing
1653,1653,LAND,Land Securities Group PLC (LAND),www.landsec.com,"100 Victoria Street London, SW1E 5JL United Kingdom",530,Equity Real Estate Investment Trusts (REITs),ORD,investing
1654,1654,ABBN,ABB Ltd (ABBN),www.global.abb/group,"Affolternstrasse 44 Zurich, 8050 Switzerland",105000,Electrical Equipment,ORD,investing
1655,1655,CCH,Coca Cola HBC AG (CCH),www.coca-colahellenic.com,"Turmstrasse 26 Steinhausen, 6312 Switzerland",26000,Beverages,ORD,investing
1656,1656,HRMS,Hermes International SCA (HRMS),finance.hermes.com,"24, rue du Faubourg-Saint-Honoré Paris, 75008 France",16966,"Textiles, Apparel & Luxury Goods",ORD,investing
1657,1657,TBCG,TBC Bank Group PLC (TBCG),www.tbcbankgroup.com,"7 Marjanishvili Street Tbilisi, 0102 Georgia",8937,Banks,ORD,investing
1658,1658,CHBE,Beneteau SA (CHBE),www.beneteau-group.com,"Les Embruns 16 boulevard de la Mer Saint-Gilles-Croix-de-Vie, 85803 France",7528,Leisure Products,ORD,investing
1659,1659,BERGb,Bergman & Beving AB (BERGb),www.bergmanbeving.com,"Box 10024 Stockholm, 100 55 Sweden",1207,Trading Companies & Distributors,ORD,investing
1660,1660,IMTP,Imerys SA (IMTP),www.imerys.com,"43 Quai de Grenelle Paris, 75015 France",-,Construction Materials,ORD,investing
1661,1661,MPL,Mercantile Ports & Logistics Ltd (MPL),www.mercpl.com,"Tudor House 1st Floor Le Bordage Road Saint Peter Port, GY1 1DB Guernsey",59,Transportation Infrastructure,ORD,investing
1662,1662,MPC,Marathon Petroleum Corp (MPC),www.marathonpetroleum.com,"539 South Main Street Findlay, 45840 United States",57900,"Oil, Gas & Consumable Fuels",ORD,investing
1663,1663,AML,Aston Martin Lagonda Global Holdings PLC (AML),www.astonmartinlagonda.com,"Banbury Road Gaydon, CV35 0DB United Kingdom",2342,Automobiles,ORD,investing
1664,1664,FEV,Fidelity European Values (FEV),www.fidelity.co.uk/investor/investment-trusts/european-values-plc.page,"Beech Gate Millfield Lane Lower Kingswood Tadworth, KT20 6RP United Kingdom",-,Capital Markets,Closed-End,investing
1665,1665,CHRH,Chr Hansen Holding A/S (CHRH),www.chr-hansen.com,"Boege AllE 10-12 Horsholm, 2970 Denmark",3702,Chemicals,ORD,investing
1666,1666,PRY,Prysmian SpA (PRY),www.prysmiangroup.com,"Via Chiese 6 Milan, 20126 Italy",30096,Electrical Equipment,ORD,investing
1667,1667,BIRG,Bank of Ireland Group PLC (BIRG),www.bankofireland.com,"40 Mespil Road Dublin, 4 Ireland",9211,Banks,ORD,investing
1668,1668,WWH,Worldwide Healthcare Trust Plc (WWH),www.worldwidewh.com,"601 Lexington Avenue 54th Floor New York, 10022 United States",-,Capital Markets,Closed-End,investing
1669,1669,NOVN,Novartis AG (NOVN),www.novartis.com,"Lichtstrasse 35 Basel, 4056 Switzerland",108000,Pharmaceuticals,ORD,investing
1670,1670,HUH1V,Huhtamaki Oyj (HUH1V),www.huhtamaki.com,"Revontulenkuja 1 Espoo, 02100 Finland",19363,Containers & Packaging,ORD,investing
1671,1671,NBPE,NB Private Equity Partners Ltd (NBPE),www.nbprivateequitypartners.com,"325 North Saint Paul Street Suite 4900 Dallas, 75201-3881 United States",1600,Capital Markets,ORD,investing
1672,1672,SMSS,Smart Metering Systems Plc (SMSS),www.sms-plc.com,"48 St. Vincent Street 2nd Floor Glasgow, G2 5TS United Kingdom",1100,Commercial Services & Supplies,ORD,investing
1673,1673,HEX,Hexagon Composites ASA (HEX),www.hexagongroup.com,"Korsegata 4B PO Box 836 Sentrum Ålesund, 6002 Norway",1060,Machinery,ORD,investing
1674,1674,FEVR,Fevertree Drinks PLC (FEVR),www.fever-tree.com,"186 -188 Shepherds Bush Road London, W6 7NL United Kingdom",250,Beverages,ORD,investing
1675,1675,SOI,Schroder Oriental Income Fund (SOI),www.schroders.com/en/uk/private-investor/fund-centre/prices-and-performance/?p=details&code=GB00B0CR,"1 London Wall Place London, EC2Y 5AU United Kingdom",-,Capital Markets,Closed-End,investing
1676,1676,BILL,BillerudKorsnas AB (BILL),www.billerudkorsnas.com,"Evenemangsgatan 17 PO Box 703 Solna, 169 27 Sweden",4398,Containers & Packaging,ORD,investing
1677,1677,GMAB,Genmab (GMAB),www.genmab.com,"Kalvebod Brygge 43 Copenhagen, 1560 Denmark",1136,Biotechnology,ORD,investing
1678,1678,TUIGn,Tui AG NA (TUIGn),www.tuigroup.com/de-de,"Karl-Wiechert-Allee 4 Hanover, 30625 Germany",46518,"Hotels, Restaurants & Leisure",ORD,investing
1679,1679,ATTE,Attendo International publ AB (ATTE),www.attendo.com,"VendevAegen 85 Danderyd, 182 91 Sweden",25000,Health Care Providers & Services,ORD,investing
1680,1680,MEKO,Mekonomen AB (MEKO),www.mekonomen.com,"SolnavAegen 4 11th Floor Stockholm, 113 65 Sweden",5053,Specialty Retail,ORD,investing
1681,1681,NPSNY,Naspers Ltd ADR (NPSNY),www.naspers.com,"40 Heerengracht Cape Town, 8001 South Africa",-,Internet & Direct Marketing Retail,ADR,investing
1682,1682,TM17,Team17 (TM17),www.team17group.com,"3 Red Hall Avenue Paragon Business Park Wakefield, WF1 2UL United Kingdom",262,Entertainment,ORD,investing
1683,1683,CHRY,Chrysalis Investments Ltd (CHRY),www.chrysalisinvestments.co.uk,"The Zig Zag Building 70 Victoria Street London, SW1E 6SQ United Kingdom",-,Capital Markets,ORD,investing
1684,1684,DPLM,Diploma PLC (DPLM),www.diplomaplc.com,"12 Charterhouse Square London, EC1M 6AX United Kingdom",2007,Trading Companies & Distributors,ORD,investing
1685,1685,NCSPq,Novorossiyskiy Morskoy Torgovyi Port PAO DRC (NCSPq),www.nmtp.info,"2 Ul. Mira Novorossiysk, 353900 Russia",6988,Transportation Infrastructure,DRC,investing
1686,1686,BKOM,Komercni Banka (BKOM),www.kb.cz,"Na PrIkope 33 Prague 1 Prague, 114 07 Czech Republic",6754,Banks,ORD,investing
1687,1687,SUN,Sulzer AG (SUN),www.sulzer.com,"Neuwiesenstrasse 15 Winterthur, 8401 Switzerland",15574,Machinery,ORD,investing
1688,1688,ABIO,Albioma SA (ABIO),www.albioma.com,"Tour Opus 12 77 esplanade du Général de Gaulle La Défense Cedex Paris, 92914 France",558,Independent Power and Renewable Electricity Producers,ORD,investing
1689,1689,EUA,Eurasia Mining (EUA),www.eurasiamining.co.uk,"Clubhouse Holborn 20 St Andrew Street London, EC4A 3AG United Kingdom",-,Metals & Mining,ORD,investing
1690,1690,PRU,Prudential PLC (PRU),www.prudentialplc.com,"1 Angel Court London, EC2R 7AG United Kingdom",16226,Insurance,ORD,investing
1691,1691,URW,WFD Unibail Rodamco NV (URW),www.urw.com,"7 place du Chancelier Adenauer CS 31622 Cedex 16 Paris, 75772 France",3049,Equity Real Estate Investment Trusts (REITs),ORD,investing
1692,1692,SOBIV,Swedish Orphan Biovitrum AB (SOBIV),www.sobi.com,"Tomtebodavägen 23A Solna, 112 76 Sweden",1532,Biotechnology,ORD,investing
1693,1693,SIGSI,Signature Aviation PLC (SIGSI),www.signatureaviation.com,"105 Wigmore Street London, W1U 1QY United Kingdom",6469,Transportation Infrastructure,ORD,investing
1694,1694,CARLb,Carlsberg A/S B (CARLb),www.carlsberggroup.com,"1 J. C. Jacobsens Gade Copenhagen V Copenhagen, 1799 Denmark",40000,Beverages,ORD,investing
1695,1695,HWDN,Howden Joinery Group Plc (HWDN),www.howdenjoinerygroupplc.com,"40 Portman Square London, W1H 6LT United Kingdom",10004,Trading Companies & Distributors,ORD,investing
1696,1696,CLSH,CLS Holdings PLC (CLSH),www.clsholdings.com,"16 Tinworth Street London, SE11 5AL United Kingdom",116,Real Estate Management & Development,REIT,investing
1697,1697,BAMI,Banco Bpm SpA (BAMI),www.bancobpm.it,"Piazza Nogara, 2 Verona, 37121 Italy",20565,Banks,ORD,investing
1698,1698,PETSP,Pets at Home Group PLC (PETSP),investors.petsathome.com,"Epsom Avenue Stanley Green Trading Estate Handforth, SK9 3RN United Kingdom",10004,Specialty Retail,ORD,investing
1699,1699,ANA,Acciona (ANA),www.acciona.com,"Avda. de Europa, 18 Parque Empresarial La Moraleja Alcobendas, 28108 Spain",38967,Electric Utilities,ORD,investing
1700,1700,MXCT,MaxCyte Inc (MXCT),www.maxcyte.com,"22 Firstfield Road Suite 110 Gaithersburg, 20878 United States",65,Life Sciences Tools & Services,ORD,investing
1701,1701,LXIL,LXi REIT PLC (LXIL),www.lxireit.com,"Mermaid House 2 Puddle Dock London, EC4V 3DB United Kingdom",-,Equity Real Estate Investment Trusts (REITs),REIT,investing
1702,1702,PEUG,Peugeot Invest SA (PEUG),www.groupe-ffp.fr/en,"66 avenue Charles de Gaulle CS 60049 Neuilly-sur-Seine, 92522 France",17,Diversified Financial Services,ORD,investing
1703,1703,IBE,Iberdrola (IBE),www.iberdrola.com,"Plaza Euskadi 5 Bilbao, 48009 Spain",39569,Electric Utilities,ORD,investing
1704,1704,ALFA,Alfa Laval AB (ALFA),www.alfalaval.com,"Rudeboksvägen 1 Lund, 226 55 Sweden",17678,Machinery,ORD,investing
1705,1705,PNL,Personal Assets Trust (PNL),www.patplc.co.uk,"33 Davies Street London, W1K 4BP United Kingdom",-,Capital Markets,Closed-End,investing
1706,1706,PROX,Proximus NV (PROX),www.proximus.com,"Proximus Towers Boulevard du Roi Albert II, 27 B Brussels, 1030 Belgium",11484,Diversified Telecommunication Services,ORD,investing
1707,1707,POLR,Polar Capital Holdings plc (POLR),www.polarcapital.co.uk,"4 Matthew Parker Street London, SW1H 9NP United Kingdom",185,Capital Markets,ORD,investing
1708,1708,AGES,Ageas (AGES),www.ageas.com,"Rue du Marquis 1/Markiesstraat 1 Box 7 Brussels, 1000 Belgium",10045,Insurance,ORD,investing
1709,1709,HPOLb,HEXPOL AB ser. B (HPOLb),www.hexpol.com,"Skeppsbron 3 Malmö, 211 20 Sweden",4697,Chemicals,ORD,investing
1710,1710,JUP,Jupiter Fund Management Plc (JUP),www.jupiteram.com/en/Jupiter-Fund-Management-plc,"The Zig Zag Building 70 Victoria Street London, SW1E 6SQ United Kingdom",590,Capital Markets,ORD,investing
1711,1711,NFC,Next Fifteen Communications Group (NFC),www.next15.com,"75 Bermondsey Street London, SE1 3XF United Kingdom",2077,Media,ORD,investing
1712,1712,AKER,Aker ASA (AKER),www.akerasa.com,"OksenOeyveien 10 Lysaker, 1366 Norway",1605,Diversified Financial Services,ORD,investing
1713,1713,CSPC,Countryside Properties PLC (CSPC),www.countrysideproperties.com,"Countryside House The Drive Brentwood, CM13 3AT United Kingdom",1924,Household Durables,ORD,investing
1714,1714,LINI,Linde PLC (LINI),www.linde.com,"The Priestley Centre 10 Priestley Road Surrey Research Park Guildford, GU2 7XY United Kingdom",72159,Chemicals,ORD,investing
1715,1715,TRG,TR European Growth Trust Plc (TRG),www.henderson.com/ukpi/fund/171/tr-european-growth-trust-plc,"201 Bishopsgate London, EC2M 3AE United Kingdom",-,Capital Markets,Closed-End,investing
1716,1716,GFCP,Gecina SA (GFCP),www.gecina.fr,"16 rue des capucines cedex 02 Paris, 75084 France",490,Equity Real Estate Investment Trusts (REITs),ORD,investing
1717,1717,3IN,3I Infrastructure PLC (3IN),www.3i-infrastructure.com,"16 Palace Street London, SW1E 5JD United Kingdom",-,Capital Markets,Closed-End,investing
1718,1718,BCU,Brunello Cucinelli (BCU),www.brunellocucinelli.com,"Viale Parco dell’Industria 5 Solomeo, Italy",2127,"Textiles, Apparel & Luxury Goods",ORD,investing
1719,1719,ARLG,Aareal Bank AG (ARLG),www.aareal-bank.com,"Paulinenstrasse 15 Wiesbaden, 65189 Germany",3115,Thrifts & Mortgage Finance,ORD,investing
1720,1720,LSEG,London Stock Exchange Group PLC (LSEG),www.lseg.com,"10 Paternoster Square London, EC4M 7LS United Kingdom",5554,Capital Markets,ORD,investing
1721,1721,VITR,Vitrolife AB (VITR),www.vitrolife.com,"Gustaf Werners gata 2 Gothenburg, 421 32 Sweden",423,Biotechnology,ORD,investing
1722,1722,TELIA,Telia Company AB (TELIA),www.teliacompany.com,"StjAerntorget 1 Solna, 169 94 Sweden",19812,Diversified Telecommunication Services,ORD,investing
1723,1723,AWE,Alphawave IP Group PLC (AWE),www.awaveip.com,"65 Gresham Street 6th Floor London, EC2V 7NQ United Kingdom",132,Semiconductors & Semiconductor Equipment,ORD,investing
1724,1724,NEXS,Nexans SA (NEXS),www.nexans.com,"Le Vinci 4 allée de l’Arche Courbevoie, 92400 France",20223,Electrical Equipment,ORD,investing
1725,1725,XPP,XP Power Ltd (XPP),www.xppowerplc.com,"No. 02-02, Haw Par Technocentre Lobby B 401 Commonwealth Drive Singapore, 149598 Singapore",2263,Electrical Equipment,ORD,investing
1726,1726,RBIV,Raiffeisen Bank International AG (RBIV),www.rbinternational.com,"Am Stadtpark 9 Vienna, 1030 Austria",45825,Banks,ORD,investing
1727,1727,BMAX,Byggmax Group AB (BMAX),www.byggmax.se,"Armégatan 38 Solna, 171 71 Sweden",1605,Specialty Retail,ORD,investing
1728,1728,AXAF,AXA SA (AXAF),www.axa.com,"25, avenue Matignon Paris, 75008 France",110278,Insurance,ORD,investing
1729,1729,CMCX,CMC Markets PLC (CMCX),www.cmcmarkets.com,"133 Houndsditch London, EC3A 7BX United Kingdom",873,Capital Markets,ORD,investing
1730,1730,TRIA,Trigano SA (TRIA),www.trigano.fr,"100, rue Petit Cedex 19 Paris, 75165 France",-,Automobiles,ORD,investing
1731,1731,HON,Honeywell International Inc (HON),www.honeywell.com,"Charlotte, NC 28202 United States",103000,Aerospace & Defense,ORD,investing
1732,1732,MUT,Murray Income Trust (MUT),www.murray-income.co.uk/itmurrayincome,"10 Queens Terrace Aberdeen, AB10 1YG United Kingdom",23000,Capital Markets,Closed-End,investing
1733,1733,NOS,Nos SGPS SA (NOS),www.nos.pt,"Rua Actor António Silva, nº9 Campo Grande Lisbon, 1600-404 Portugal",2242,Diversified Telecommunication Services,ORD,investing
1734,1734,QLT,Quilter PLC (QLT),www.quilter.com,"Senator House 85 Queen Victoria Street London, EC4V 4AB United Kingdom",4176,Capital Markets,ORD,investing
1735,1735,ITRK,Intertek Group PLC (ITRK),www.intertek.com,"33 Cavendish Square London, W1G 0PS United Kingdom",43769,Professional Services,ORD,investing
1736,1736,HBR,Harbour Energy PLC (HBR),www.harbourenergy.com,"Saltire Court 4th Floor 20 Castle Terrace Edinburgh, EH1 2EN United Kingdom",1800,"Oil, Gas & Consumable Fuels",ORD,investing
1737,1737,PAGPA,Paragon Banking Group PLC (PAGPA),www.paragonbankinggroup.co.uk,"Paragon House 51 Homer Road Solihull, B91 3QJ United Kingdom",1400,Thrifts & Mortgage Finance,ORD,investing
1738,1738,0538q,Hyundai Motor Co DRC (0538q),www.hyundai.com/worldwide/en,"12, Heolleung-ro Seocho-gu Seoul, South Korea",70388,Automobiles,DRC,investing
1739,1739,RCH,Reach PLC (RCH),www.reachplc.com,"One Canada Square Canary Wharf London, E14 5AP United Kingdom",4184,Media,ORD,investing
1740,1740,RXL,Rexel (RXL),www.rexel.com,"13, Boulevard du Fort de Vaux Cedex 17 Cedex 17 Paris, 75838 France",24469,Trading Companies & Distributors,ORD,investing
1741,1741,LKOH,NK Lukoil PAO (LKOH),www.lukoil.com,"11, Sretensky Boulevard Moscow, 101000 Russia",101374,"Oil, Gas & Consumable Fuels",ORD,investing
1742,1742,SAPG,SAP SE (SAPG),www.sap.com,"Dietmar-Hopp-Allee 16 Walldorf, 69190 Germany",105015,Software,ORD,investing
1743,1743,BONAVb,Bonava AB B (BONAVb),www.bonava.com,"Lindhagensgatan 72 Stockholm, 112 18 Sweden",2100,Household Durables,ORD,investing
1744,1744,TATE,Tate & Lyle PLC (TATE),www.tateandlyle.com,"1 Kingsway London, WC2B 6AT United Kingdom",4441,Food Products,ORD,investing
1745,1745,BATS,British American Tobacco PLC (BATS),www.bat.com,"Globe House 4 Temple Place London, WC2R 2PG United Kingdom",56689,Tobacco,ORD,investing
1746,1746,BBH,BB Healthcare Trust PLC (BBH),www.bbhealthcaretrust.com/en/bb-healthcare-trust,"Seestrasse 16 Kusnacht, 8700 Switzerland",-,Capital Markets,ORD,investing
1747,1747,GNC,Greencore Group (GNC),www.greencore.com,"No. 2 Northwood Avenue Northwood Business Park Santry Dublin, D09 X5N9 Ireland",12200,Food Products,ORD,investing
1748,1748,NEX,National Express Group (NEX),www.nationalexpressgroup.com,"National Express House Birmingham Coach Station Mill Lane Digbeth Birmingham, B5 6DD United Kingdom",47971,Road & Rail,ORD,investing
1749,1749,PZC,PZ Cussons PLC (PZC),www.pzcussons.com,"Manchester Business Park 3500 Aviator Way Manchester, M22 5TG United Kingdom",2943,Personal Products,ORD,investing
1750,1750,FUTR,Future PLC (FUTR),www.futureplc.com,"Quay House The Ambury Bath, BA1 1UA United Kingdom",2037,Media,ORD,investing
1751,1751,AGL,Autogrill SpA (AGL),www.autogrill.com,"Centro Direzionale Milanofiori Palazzo Z Strada 5 Rozzano, 20089 Italy",30000,"Hotels, Restaurants & Leisure",ORD,investing
1752,1752,PM,Philip Morris International Inc (PM),www.pmi.com,"120 Park Avenue New York, 10017-5592 United States",71000,Tobacco,ORD,investing
1753,1753,HYMLY,Hyundai Motor Co ADR (HYMLY),www.hyundai.com/worldwide/en,"12, Heolleung-ro Seocho-gu Seoul, South Korea",70388,Automobiles,ADR,investing
1754,1754,RESURS,Resurs Holding AB (RESURS),www.resursholding.com/en,"Ekslingan 9 VAela Norra Helsingborg, Sweden",664,Consumer Finance,ORD,investing
1755,1755,BURF,Burford Capital Ltd (BURF),www.burfordcapital.com,"Oak House Hirzel Street Saint Peter Port, GY1 2NP Guernsey",133,Diversified Financial Services,ORD,investing
1756,1756,ABDN,Abrdn PLC (ABDN),www.standardlifeaberdeen.com,"1 George Street Edinburgh, EH2 2LL United Kingdom",6029,Capital Markets,ORD,investing
1757,1757,SBIq,State Bank of India DRC (SBIq),www.sbi.co.in,"State Bank Bhavan 14th Floor Corporate Centre Madame Cama Road, Nariman Point Mumbai,400021 India",245652,Banks,DRC,investing
1758,1758,NZYMb,Novozymes A/S B (NZYMb),www.novozymes.com,"Krogshoejvej 36 Bagsvaerd, 2880 Denmark",6369,Chemicals,ORD,investing
1759,1759,IETB,D’Ieteren NV (IETB),www.dieterengroup.com,"Rue du Mail, 50 Brussels, 1050 Belgium",1730,Distributors,ORD,investing
1760,1760,USAB,Baillie Gifford US Growth Trust PLC (USAB),www.bailliegifford.com/en/uk/individual-investors/funds/baillie-gifford-us-growth-trust,"Calton Square 1 Greenside Row Edinburgh, EH1 3AN United Kingdom",-,Capital Markets,ORD,investing
1761,1761,IWG,IWG PLC (IWG),www.iwgplc.com,"Dammstrasse 19 Zug, 6300 Switzerland",12000,Real Estate Management & Development,ORD,investing
1762,1762,PHI,Pacific Horizon Investment Trust (PHI),www.bailliegifford.com/en/uk/individual-investors/funds/pacific-horizon-investment-trust,"Calton Square 1 Greenside Row Edinburgh, EH1 3AN United Kingdom",550,Capital Markets,Closed-End,investing
1763,1763,IPAR,Inter Parfums Inc. (IPAR),www.interparfums.fr,"4, rond-point des Champs-Élysées Paris, 75008 France",291,Personal Products,ORD,investing
1764,1764,PALF,Palfinger AG (PALF),www.palfinger.ag,"Lamprechtshausener Bundesstrasse 8 Bergheim, 5101 Austria",11653,Machinery,ORD,investing
1765,1765,CTY,City Of London Investment Trust (CTY),www.henderson.com/ukpa/fund/169/the-city-of-london-investment-trust-plc,"201 Bishopsgate London, EC2M 3AE United Kingdom",-,Capital Markets,Closed-End,investing
1766,1766,MRCH,Merchants Trust PLC (MRCH),www.merchantstrust.co.uk/Navigate.aspx/Merchants/1/About-the-Trust/Overview,"199 Bishopsgate London, EC2M 3TY United Kingdom",-,Capital Markets,ORD,investing
1767,1767,ENTRA,Entra ASA (ENTRA),www.entra.no,"Biskop Gunnerus gate 14 A Oslo, 0185 Norway",182,Real Estate Management & Development,ORD,investing
1768,1768,ZURN,Zurich Insurance Group AG (ZURN),www.zurich.com,"Mythenquai 2 Zurich, 8002 Switzerland",55000,Insurance,ORD,investing
1769,1769,VOWG,Volkswagen AG (VOWG),www.volkswagenag.com,"Berliner Ring 2 Wolfsburg, 38440 Germany",645318,Automobiles,ORD,investing
1770,1770,RENA,Renault SA (RENA),www.group.renault.com,"13-15 quai Le Gallo Boulogne-Billancourt, 92109 France",170158,Automobiles,ORD,investing
1771,1771,DRX,Drax Group (DRX),www.drax.com,"Drax Power Station Selby, YO8 8PH United Kingdom",2897,Independent Power and Renewable Electricity Producers,ORD,investing
1772,1772,SEIT,Sdcl Energy Efficiency Income Trust PLC (SEIT),www.sdcleeit.com,"32 Old Burlington Street London, W1S 3AT United Kingdom",-,Capital Markets,ORD,investing
